Filename,Category,ArtworkName,Year,Title,LinkLabel,Link
phuketbeach.jpg,THAILAND,Phuket Beach,2026,thailand phuket beach dolphin town star moon hills city, Shop this Design, https://www.redbubble.com/shop/ap/182002973
jettyroadbrighton.jpg,JETTY ROAD BRIGHTON,Jetty Road Brighton,2021,jetty road brighton beach aerial town city, Shop Jetty Road Brighton, https://www.redbubble.com/shop/ap/123324857
henleysquare.jpg,AERIAL TOWNS,Henley Square,2024,henley square beach aerial town city,Shop Henley,https://www.redbubble.com/shop/ap/165480514
cocktailsandcockatoos.jpg,WHITSUNDAYS,Cocktails and Cockatoos,2025, hayman island warmer waters paradise resort cockatoo lady helicopter turtle cocktail pool,prints and more,https://www.redbubble.com/shop/ap/171000341
adelaidecitysunset.jpg,ADELAIDE,Adelaide City Sunset,2024,adelaide city sunset skyline buildings town South Australia,Shop Adelaide by Azzurro, XXXXXXX
santis.jpg,STORYBOOK,Santi,2024,henley beach santi santi's santis goat shepherd castle,Private Commission
